{"schemaVersion":1,"packageId":"fixture-map","revisionId":"fixture-map","packageContentHash":"d643bff5f1ae5685ea50e9cda59e01f82477e50ca5e89c88006ae1420c5d7980","mappingApprovalHash":"63bc47c1bc4ffc78a01d55c4ef3536aa777ec218eec3fff04fb06816455ef12d","validationReportHash":"f291664e23243998c3cf3395d85f145cacc1c288eb8eec60c6d4a51afb85a133","reviewEvidenceHash":"5145762e780af382523bcbaa502707243e8d3737cbb1f66ffafa4bbfe5154223","mappingApprovalId":"mapping-fixture","importApprovalHash":"5298b109af43b9240354e7332df20f45b31b31f5bb0208ab8146846b61a29fd5","importApprovalId":"import-fixture","importedAt":"2026-09-28T00:00:00Z"}
